{
  "id": "M001208",
  "bioguideId": "M001208",
  "name": "Lucy McBath",
  "firstName": "Lucy",
  "lastName": "McBath",
  "party": "D",
  "chamber": "House",
  "state": "Georgia",
  "stateCode": "GA",
  "district": "6",
  "currentTerm": {
    "congress": 119,
    "chamber": "House",
    "state": "Georgia",
    "district": "6",
    "startYear": 2025
  },
  "sponsoredBillIds": [
    "119-hr-10031"
  ],
  "cosponsoredBillIds": [],
  "recentVoteIds": [
    "119-house-2-283",
    "119-house-2-282",
    "119-house-2-281",
    "119-house-2-280",
    "119-house-2-279",
    "119-house-2-278",
    "119-house-2-277",
    "119-house-2-276",
    "119-house-2-275",
    "119-house-2-274",
    "119-house-2-273",
    "119-house-2-272",
    "119-house-2-271",
    "119-house-2-270",
    "119-house-2-269",
    "119-house-2-268",
    "119-house-2-267",
    "119-house-2-266",
    "119-house-2-265",
    "119-house-2-264",
    "119-house-2-263",
    "119-house-2-262",
    "119-house-2-261",
    "119-house-2-260",
    "119-house-2-259"
  ],
  "officialUrl": "https://mcbath.house.gov"
}