{
  "id": "C001095",
  "bioguideId": "C001095",
  "name": "Tom Cotton",
  "firstName": "Tom",
  "lastName": "Cotton",
  "party": "R",
  "chamber": "Senate",
  "state": "Arkansas",
  "stateCode": "AR",
  "currentTerm": {
    "congress": 119,
    "chamber": "Senate",
    "state": "Arkansas",
    "startYear": 2025
  },
  "sponsoredBillIds": [
    "119-s-5458",
    "119-s-5454"
  ],
  "cosponsoredBillIds": [],
  "recentVoteIds": [],
  "officialUrl": "https://www.cotton.senate.gov"
}