{
  "id": "S001223",
  "bioguideId": "S001223",
  "name": "Emilia Strong Sykes",
  "firstName": "Emilia",
  "lastName": "Sykes",
  "party": "D",
  "chamber": "House",
  "state": "Ohio",
  "stateCode": "OH",
  "district": "13",
  "currentTerm": {
    "congress": 119,
    "chamber": "House",
    "state": "Ohio",
    "district": "13",
    "startYear": 2025
  },
  "sponsoredBillIds": [
    "119-hr-10900"
  ],
  "cosponsoredBillIds": [],
  "recentVoteIds": [
    "119-house-2-314",
    "119-house-2-313",
    "119-house-2-312",
    "119-house-2-311",
    "119-house-2-310",
    "119-house-2-309",
    "119-house-2-308",
    "119-house-2-307",
    "119-house-2-306",
    "119-house-2-305",
    "119-house-2-304",
    "119-house-2-303",
    "119-house-2-302",
    "119-house-2-301",
    "119-house-2-300",
    "119-house-2-299",
    "119-house-2-298",
    "119-house-2-297",
    "119-house-2-296",
    "119-house-2-295",
    "119-house-2-294",
    "119-house-2-293",
    "119-house-2-292",
    "119-house-2-291",
    "119-house-2-290"
  ],
  "officialUrl": "https://sykes.house.gov"
}