{
  "id": "K000367",
  "bioguideId": "K000367",
  "name": "Amy Klobuchar",
  "firstName": "Amy",
  "lastName": "Klobuchar",
  "party": "D",
  "chamber": "Senate",
  "state": "Minnesota",
  "stateCode": "MN",
  "currentTerm": {
    "congress": 119,
    "chamber": "Senate",
    "state": "Minnesota",
    "startYear": 2025
  },
  "sponsoredBillIds": [
    "119-s-2339"
  ],
  "cosponsoredBillIds": [],
  "recentVoteIds": [],
  "officialUrl": "https://www.klobuchar.senate.gov/"
}