{
  "id": "D000618",
  "bioguideId": "D000618",
  "name": "Steve Daines",
  "firstName": "Steve",
  "lastName": "Daines",
  "party": "R",
  "chamber": "Senate",
  "state": "Montana",
  "stateCode": "MT",
  "currentTerm": {
    "congress": 119,
    "chamber": "Senate",
    "state": "Montana",
    "startYear": 2025
  },
  "sponsoredBillIds": [
    "119-s-239"
  ],
  "cosponsoredBillIds": [],
  "recentVoteIds": [],
  "officialUrl": "https://www.daines.senate.gov"
}