{
  "id": "M001205",
  "bioguideId": "M001205",
  "name": "Carol D. Miller",
  "firstName": "Carol",
  "lastName": "Miller",
  "party": "R",
  "chamber": "House",
  "state": "West Virginia",
  "stateCode": "WV",
  "district": "1",
  "currentTerm": {
    "congress": 119,
    "chamber": "House",
    "state": "West Virginia",
    "district": "1",
    "startYear": 2025
  },
  "sponsoredBillIds": [
    "119-hr-10193"
  ],
  "cosponsoredBillIds": [],
  "recentVoteIds": [
    "119-house-2-295",
    "119-house-2-294",
    "119-house-2-293",
    "119-house-2-292",
    "119-house-2-291",
    "119-house-2-290",
    "119-house-2-289",
    "119-house-2-288",
    "119-house-2-287",
    "119-house-2-286",
    "119-house-2-285",
    "119-house-2-284",
    "119-house-2-283",
    "119-house-2-282",
    "119-house-2-281",
    "119-house-2-280",
    "119-house-2-279",
    "119-house-2-278",
    "119-house-2-277",
    "119-house-2-276",
    "119-house-2-275",
    "119-house-2-274",
    "119-house-2-273",
    "119-house-2-272",
    "119-house-2-271"
  ],
  "officialUrl": "https://miller.house.gov/"
}