{
  "id": "S001208",
  "bioguideId": "S001208",
  "name": "Elissa Slotkin",
  "firstName": "Elissa",
  "lastName": "Slotkin",
  "party": "D",
  "chamber": "Senate",
  "state": "Michigan",
  "stateCode": "MI",
  "currentTerm": {
    "congress": 119,
    "chamber": "Senate",
    "state": "Michigan",
    "startYear": 2025
  },
  "sponsoredBillIds": [
    "119-s-5343",
    "119-s-5342"
  ],
  "cosponsoredBillIds": [],
  "recentVoteIds": [],
  "officialUrl": "https://www.slotkin.senate.gov/"
}